{
  "id": "nber-data",
  "name": {
    "en": "NBER Data Library",
    "zh": "国家经济研究局数据库",
    "native": "NBER Data Library"
  },
  "organization": {
    "name": "National Bureau of Economic Research",
    "type": "research_institution",
    "country": "US",
    "website": "https://www.nber.org"
  },
  "description": {
    "en": "A private, nonprofit research organization facilitating cutting-edge economic research. Features over 34,000 working papers, public-use economic datasets, and comprehensive economic indicators. Affiliated with 1,800+ economists including 43 Nobel Prize winners.",
    "zh": "私营非营利研究组织，促进前沿经济研究。包含超过34,000篇工作论文、公共使用经济数据集和全面的经济指标。拥有1,800多名经济学家，其中包括43位诺贝尔奖获得者。"
  },
  "access": {
    "primary_url": "https://www.nber.org",
    "api": {
      "available": false,
      "documentation": null,
      "version": null,
      "authentication": null
    },
    "download": {
      "available": true,
      "formats": ["PDF", "CSV", "Excel", "Stata"]
    },
    "access_level": "registration",
    "registration_required": false
  },
  "coverage": {
    "geographic": {
      "scope": "global",
      "regions": ["North America", "Global"]
    },
    "temporal": {
      "start_year": 1920,
      "end_year": 2025,
      "update_frequency": "weekly"
    },
    "domains": ["economics", "finance", "labor", "health", "productivity"]
  },
  "data_content": {
    "en": [
      "Working papers on economic research (34,000+ papers)",
      "Business cycle dating and recession indicators",
      "Labor economics and employment data",
      "Productivity and economic growth metrics",
      "Health economics and policy research",
      "International trade and finance data",
      "Public-use microdata from research projects",
      "Economic indicators and releases aggregation",
      "Monetary economics and financial markets research"
    ],
    "zh": [
      "经济研究工作论文（34,000+篇）",
      "商业周期确定和衰退指标",
      "劳动经济学和就业数据",
      "生产率和经济增长指标",
      "健康经济学和政策研究",
      "国际贸易和金融数据",
      "研究项目的公共使用微观数据",
      "经济指标和发布聚合",
      "货币经济学和金融市场研究"
    ]
  },
  "data_characteristics": {
    "types": ["text", "time-series", "cross-sectional", "panel"],
    "granularity": ["individual-level", "firm-level", "country-level", "aggregate"],
    "formats": ["PDF", "CSV", "Excel", "Stata", "HTML"],
    "languages": ["en"]
  },
  "quality": {
    "authority_level": 5,
    "methodology_transparency": 5,
    "update_timeliness": 5,
    "data_completeness": 4,
    "documentation_quality": 5,
    "citation_count": 5
  },
  "licensing": {
    "license": "Mixed - Open access for 30,000+ papers, subscription required for recent papers",
    "commercial_use": true,
    "attribution_required": true,
    "restrictions": [
      "Recent working papers require subscription access",
      "No policy recommendations allowed in papers"
    ]
  },
  "metadata": {
    "standards_followed": ["Academic citation standards"],
    "data_dictionary": true,
    "methodology_docs": true,
    "user_guide": true
  },
  "usage": {
    "use_cases": [
      "Academic economic research",
      "Policy analysis and evaluation",
      "Business cycle tracking",
      "Labor market analysis",
      "Financial market research",
      "Health economics studies"
    ],
    "example_studies": [
      "Business cycle dating for US recessions",
      "Labor productivity trends analysis",
      "Health policy impact evaluations"
    ],
    "code_examples": []
  },
  "related_sources": [
    "worldbank-open-data",
    "imf-data",
    "bls-data"
  ],
  "contact": {
    "email": "info@nber.org",
    "support_url": "https://www.nber.org/contact-nber",
    "phone": "+1-617-868-3900"
  },
  "catalog_metadata": {
    "added_date": "2025-12-05",
    "last_updated": "2025-12-05",
    "verified_date": "2025-12-05",
    "contributor": "DataSource Hub Team",
    "status": "active"
  },
  "tags": [
    "economics",
    "research-papers",
    "working-papers",
    "business-cycle",
    "labor-economics",
    "productivity",
    "financial-markets",
    "health-economics",
    "academic-research",
    "nobel-laureates"
  ]
}
