{
  "id": "imagenet",
  "name": {
    "en": "ImageNet",
    "zh": "ImageNet 图像数据库"
  },
  "organization": {
    "name": "Stanford Vision Lab & Princeton University",
    "type": "research_institution",
    "country": "US",
    "website": "https://www.image-net.org"
  },
  "description": {
    "en": "ImageNet is a large-scale image database organized according to the WordNet hierarchy. It contains over 14 million images spanning more than 21,000 synsets (synonym sets). The most widely-used subset is the ImageNet Large Scale Visual Recognition Challenge (ILSVRC) 2012-2017 dataset, which includes 1,000 object classes with 1.28 million training images, 50,000 validation images, and 100,000 test images. ImageNet has been instrumental in advancing computer vision and deep learning research.",
    "zh": "ImageNet 是一个按照 WordNet 层次结构组织的大规模图像数据库。包含超过 1400 万张图像，涵盖 21,000 多个同义词集。最广泛使用的子集是 ImageNet 大规模视觉识别挑战赛（ILSVRC）2012-2017 数据集，包含 1,000 个对象类别，128 万训练图像、5 万验证图像和 10 万测试图像。ImageNet 在推动计算机视觉和深度学习研究方面发挥了重要作用。"
  },
  "access": {
    "primary_url": "https://www.image-net.org",
    "api": {
      "available": false,
      "documentation": null,
      "version": null,
      "authentication": null
    },
    "download": {
      "available": true,
      "formats": ["tar", "zip"]
    },
    "access_level": "academic",
    "registration_required": true
  },
  "coverage": {
    "geographic": {
      "scope": "global"
    },
    "temporal": {
      "start_year": 2009,
      "end_year": 2017,
      "update_frequency": "one-time"
    },
    "domains": [
      "Computer Vision",
      "Deep Learning",
      "Machine Learning",
      "Artificial Intelligence",
      "Image Classification",
      "Object Recognition"
    ],
    "indicators": 21841
  },
  "data_content": {
    "en": [
      "Image Classification - 1,000 object categories (ILSVRC subset)",
      "Object Localization - Bounding box annotations for objects",
      "Visual Recognition - 21,841 synsets covering diverse concepts",
      "Training Data - 1,281,167 labeled training images",
      "Validation Data - 50,000 validation images with ground truth",
      "Test Data - 100,000 test images for benchmarking",
      "WordNet Hierarchy - Structured organization of visual concepts"
    ],
    "zh": [
      "图像分类 - 1,000 个对象类别（ILSVRC 子集）",
      "对象定位 - 对象边界框标注",
      "视觉识别 - 21,841 个同义词集覆盖多样化概念",
      "训练数据 - 1,281,167 张已标注训练图像",
      "验证数据 - 50,000 张带真实标签的验证图像",
      "测试数据 - 100,000 张用于基准测试的测试图像",
      "WordNet 层次结构 - 视觉概念的结构化组织"
    ]
  },
  "data_characteristics": {
    "types": ["image", "cross-sectional"],
    "granularity": ["image-level", "object-level"],
    "formats": ["JPEG", "tar", "zip"],
    "languages": ["en"]
  },
  "quality": {
    "authority_level": 5,
    "methodology_transparency": 5,
    "update_timeliness": 3,
    "data_completeness": 5,
    "documentation_quality": 5,
    "citation_count": 5
  },
  "licensing": {
    "license": "Non-commercial Research and Educational Use Only",
    "commercial_use": false,
    "attribution_required": true,
    "restrictions": [
      "Non-commercial use only",
      "Research and educational purposes only",
      "Users must agree to terms of access",
      "Researchers are fully responsible for their use of the database",
      "For-profit entities require employer agreement to terms"
    ]
  },
  "metadata": {
    "standards_followed": ["WordNet Hierarchy", "ILSVRC Benchmark"],
    "data_dictionary": true,
    "methodology_docs": true,
    "user_guide": true
  },
  "usage": {
    "use_cases": [
      "Training deep learning models for image classification",
      "Benchmarking computer vision algorithms",
      "Object detection and localization research",
      "Transfer learning for visual recognition tasks",
      "Pre-training convolutional neural networks (CNNs)",
      "Academic research in computer vision and AI"
    ],
    "example_studies": [
      "AlexNet (2012) - Breakthrough in deep learning using ImageNet",
      "ResNet (2015) - Deep residual learning for image recognition",
      "VGGNet (2014) - Very deep convolutional networks",
      "Inception/GoogLeNet (2014) - Efficient deep architectures"
    ]
  },
  "related_sources": [],
  "contact": {
    "email": "imagenet.help.desk@gmail.com",
    "support_url": "https://www.image-net.org"
  },
  "catalog_metadata": {
    "added_date": "2025-12-10",
    "last_updated": "2025-12-10",
    "verified_date": "2025-12-10",
    "contributor": "DataSource Hub Team",
    "status": "active"
  },
  "tags": [
    "computer-vision",
    "deep-learning",
    "image-classification",
    "machine-learning",
    "benchmark-dataset",
    "object-recognition",
    "convolutional-neural-networks",
    "transfer-learning",
    "academic-research",
    "visual-recognition"
  ]
}
