{
  "id": "afdb",
  "name": {
    "en": "African Development Bank",
    "zh": "非洲开发银行"
  },
  "organization": {
    "name": "African Development Bank Group",
    "type": "international_organization",
    "country": null,
    "website": "https://www.afdb.org"
  },
  "description": {
    "en": "The African Development Bank (AfDB) provides comprehensive statistical data and development indicators for African countries. The bank's statistics department maintains the Africa Information Highway (AIH), a mega network of open data platforms covering all African countries and 16 regional organizations. It offers socio-economic data, project information, and development statistics to support evidence-based policymaking and monitor development progress across Africa.",
    "zh": "非洲开发银行（AfDB）提供全面的非洲国家统计数据和发展指标。该银行统计部门维护非洲信息高速公路（AIH），这是一个覆盖所有非洲国家和16个区域组织的开放数据平台大型网络。它提供社会经济数据、项目信息和发展统计数据，以支持基于证据的政策制定并监测非洲的发展进展。"
  },
  "access": {
    "primary_url": "https://www.afdb.org/en/knowledge/statistics",
    "api": {
      "available": true,
      "documentation": "http://dataportal.opendataforafrica.org/",
      "version": "REST",
      "authentication": false
    },
    "download": {
      "available": true,
      "formats": ["CSV", "Excel", "JSON", "XML"]
    },
    "access_level": "open",
    "registration_required": false
  },
  "coverage": {
    "geographic": {
      "scope": "regional",
      "regions": ["Africa"],
      "countries": 54,
      "description": "All African countries and 16 regional organizations"
    },
    "temporal": {
      "start_year": 1960,
      "end_year": 2024,
      "update_frequency": "annual",
      "last_updated": "2024"
    },
    "domains": [
      "Development Finance",
      "Economic Statistics",
      "Social Development",
      "Infrastructure",
      "Agriculture",
      "Energy",
      "Climate Change",
      "Governance",
      "Health",
      "Education"
    ],
    "indicators": 1000
  },
  "data_content": {
    "en": [
      "Socio-Economic Database: Agriculture, debt, economic indicators, energy, financial flows, governance, ICT, infrastructure, national accounts, prices, production, public finance (1960-2024)",
      "Bank Operations and Project Data: All AfDB lending projects from 1967 onwards with financial information and IATI-compliant results",
      "Country Policy and Institutional Assessment (CPIA): Biennial policy quality and institutional framework assessments for 54 African countries",
      "SDGs Data Hubs: Sustainable Development Goals monitoring data for Africa",
      "Statistical Publications: Compendium of Statistics on Bank Group Operations and AfDB Statistics Pocketbook"
    ],
    "zh": [
      "社会经济数据库：农业、债务、经济指标、能源、金融流动、治理、ICT、基础设施、国民账户、价格、生产、公共财政（1960-2024）",
      "银行业务和项目数据：自1967年以来所有非洲开发银行贷款项目及财务信息和符合IATI标准的成果",
      "国家政策和制度评估（CPIA）：对54个非洲国家的政策质量和制度框架进行两年一次的评估",
      "可持续发展目标数据中心：非洲可持续发展目标监测数据",
      "统计出版物：银行集团业务统计汇编和非洲开发银行统计手册"
    ]
  },
  "data_characteristics": {
    "types": [
      "statistical",
      "time-series",
      "cross-sectional",
      "geospatial"
    ],
    "granularity": [
      "country-level",
      "regional",
      "sectoral"
    ],
    "formats": ["CSV", "Excel", "JSON", "XML", "PDF"],
    "languages": ["en", "fr", "ar"]
  },
  "quality": {
    "authority_level": 5,
    "methodology_transparency": 4,
    "update_timeliness": 4,
    "data_completeness": 5,
    "documentation_quality": 4,
    "citation_count": 5,
    "average_score": 4.5,
    "assessment_notes": {
      "en": "AfDB is the premier multilateral development finance institution for Africa with the highest authority on African development data. Comprehensive coverage of all 54 African countries with data dating back to 1960. Strong documentation and publications. The Africa Information Highway initiative represents a major advancement in African data accessibility.",
      "zh": "非洲开发银行是非洲首要的多边开发金融机构，在非洲发展数据方面具有最高权威性。覆盖所有54个非洲国家，数据可追溯至1960年。文档和出版物质量优秀。非洲信息高速公路计划代表了非洲数据可及性的重大进步。"
    }
  },
  "licensing": {
    "license": "Open Data (Terms of Use)",
    "commercial_use": true,
    "attribution_required": true,
    "restrictions": []
  },
  "metadata": {
    "standards_followed": ["IATI", "SDMX", "Dublin Core"],
    "data_dictionary": true,
    "methodology_docs": true,
    "user_guide": true
  },
  "usage": {
    "use_cases": [
      "Development policy research",
      "Cross-country comparative analysis",
      "SDG monitoring",
      "Investment decision-making",
      "Academic research on African development",
      "Project evaluation and impact assessment"
    ]
  },
  "contact": {
    "email": "statistics@afdb.org",
    "support_url": "https://www.afdb.org/en/knowledge/statistics/publications"
  },
  "tags": [
    "development-finance",
    "africa",
    "economic-development",
    "social-development",
    "infrastructure",
    "SDGs",
    "multilateral-development-bank",
    "open-data",
    "project-data",
    "IATI"
  ],
  "catalog_metadata": {
    "added_date": "2025-12-11",
    "last_updated": "2025-12-11",
    "status": "active",
    "verified_date": "2025-12-11",
    "contributor": "AI Assistant"
  }
}
